Name,id,Url
Pheme Pro Subscription (Annual),plink_1SG5zWEmHXkjAFxS6OKYani9,https://buy.stripe.com/14A5kD0fg0hk5LJ69ebbG05
Pheme Pro Subscription (Annual),plink_1SG5zWEmHXkjAFxS9iDAhr1u,https://buy.stripe.com/eVq9AT7HI7JM4HFdBGbbG04
Pheme Pro Subscription (Annual),plink_1SG5zWEmHXkjAFxSgDlETQz1,https://buy.stripe.com/14A28r3rs6FI7TR416bbG03
Pheme Pro Subscription (Monthly),plink_1SG5zVEmHXkjAFxSWm6xgsq3,https://buy.stripe.com/eVq9AT8LMc02a1Z7dibbG02
Pheme Creator Subscription (Monthly),plink_1SG5zVEmHXkjAFxSGIrh24VC,https://buy.stripe.com/eVqaEXd22fcegqn416bbG01
Pheme Starter Subscription (Monthly),plink_1SG5zVEmHXkjAFxS55aTmfXA,https://buy.stripe.com/14A00j0fg0hka1ZbtybbG00